,Jobs,Company,Location,Description
86,"Data Scientist / Analyst (Informatiker, Mathematiker) (d/m/w) für die Abteilung Datenmanagement",Institut des Bewertungsausschusses,Berlin,"Wir suchen Sie zum nächstmöglichen Zeitpunkt als Data Scientist / Analyst (Informatiker, Mathematiker) (d/m/w) für die Abteilung Datenmanagement."
87,Big Data & Analytics Architect (m/w/d),Sopra Steria SE,"Bundesweit, Berlin, Frankfurt am Main, Hamburg, Köln, Leipzig, München",Entwicklung von Use Cases für unseren Kundenbereich in den Themen (Big) Data Engineering & Analytics und Data Science * Übernahme der (Teil-)Projektleitung von (Big)Data Engineering und Data Science Projekten
88,Data Warehouse Developer (m/w/d),DKB Service GmbH,Berlin,"Deinen Blick für Datenstrukturen nutzen, um den Geschäftsfeldern bei der Integration ihrer Daten in das Data Warehouse zu beraten"
89,Berater Business Intelligence (BI) und DataWarehousing (m/w/d),IDL-Unternehmensgruppe,"Hamburg/Ahrensburg, Berlin, Hannover, Frankfurt a.M./Schmitten, Düsseldorf","Mindestens drei Jahre praktische Erfahrung in den Themen Data Warehouse, Business Intelligence, ETL-Prozesse."
90,Business Analyst (m/w/d) Consulting – SAP Cloud Platform Developer (SCP),Deloitte,"Berlin, Düsseldorf, Frankfurt am Main, Hannover, Hamburg, Köln, Stuttgart, München, Walldorf","Deloitte * Berlin, Düsseldorf, Frankfurt am Main, Hannover, Hamburg, Köln, Stuttgart, München, Walldorf * Feste Anstellung * Vollzeit - Job Nummer: 26155"
91,(Senior) Consultant (m/w/d) Analytics & Information Management – SAP Leonardo,Deloitte,"Berlin, Düsseldorf, Frankfurt, Hannover, Hamburg, München, Stuttgart, Walldorf","Das Deloitte-Analytics-Team im berät unsere Kunden bei besonders interessanten Themen, wie z. B. Big Data, Advanced Analytics und Visualisierung."
92,Analyst/Consultant (m/f/d) Valuation,BNP Paribas Real Estate,"Berlin, Düsseldorf, Frankfurt, Hamburg, München","BNP Paribas Real Estate * Berlin, Düsseldorf, Frankfurt, Hamburg, München * Feste Anstellung * Vollzeit"
93,Lead Data Analyst (m/w/d),BWI GmbH,"Nürnberg, München, Rheinbach, Berlin",Gestalten Sie mit uns eine der größten und komplexesten IT-Landschaften Deutschlands und unterstützen Sie unser Team als Lead Data Analyst (m/w/d)
94,Business Analyst (m/w/d),Verti Versicherung AG,Teltow bei Berlin,"Verti Versicherung AG * Teltow bei Berlin * Feste Anstellung * Teilzeit,Vollzeit - Die Verti Versicherung AG ist mit mehr als 800.000 versicherten Kraftfahrzeugen die zweitgrößte Kfz-Direktversicherung in Deutschland."
95,Data Scientist (m/w/d) im Bereich Consulting,Mazars Advisors GmbH & Co. KG,"Berlin, Düsseldorf, Frankfurt a.M., Hamburg und München",Wir suchen einen Data Scientist (m/w/d) im Bereich Consulting * Verantwortung von Anfang an: Als Data Scientist (m/w/d) steuern Sie den Neuaufbau einer Datenanalyse-Infrastruktur in ...
96,Data Scientist (m/w/d),Deutsche Telekom AG,"Bonn, Berlin, Bremen, Hamburg, Darmstadt, Frankfurt, München",Als Data Scientist (m/w/d) agieren Sie in unseren Top-Projekten im Bereich Datenanalyse vom Nachfragemanagement zum Proof-of-Concept bis zum Go-Live.
97,(Wirtschafts-) Informatiker/Mathematiker als (Big) Data Engineer (m/w/d),Sopra Steria SE,"Bundesweit, Berlin, Frankfurt am Main, Hamburg, Köln, Leipzig, München","Entwicklung innovativer Datenlösungen mit Methoden des modernen Datenmanagements vom Import strukturierter und unstrukturierter Rohdaten, deren Aufbereitung und Transformation,Metadatenmanagement bis hin zur ..."
98,Analyst/Data Scientist (m/w/d) Data & Testing,ZEIT Online GmbH,Hamburg oder Berlin,Bereichern Sie unser Team als Analyst/Data Scientist (m/w/d) Data & Testing
99,Physiker / Informatiker / Mathematiker als Consultant Data & Analytics (m/w/d),Cintellic GmbH,"Bonn,Frankfurt a. M.,Köln,Düsseldorf,Essen,Heidelberg,Würzburg,Wiesbaden,Hamburg,München,Berlin","Unsere Leistung basiert auf einem breiten Expertenwissen im Zusammenspiel von Business, Data und Technology. * Erste Erfahrungen in Projekten aus dem Bereich Data Warehouse / Business Intelligence / Analytics sind wünschenswert"
